{
  "version": "v1",
  "trace_id": "trace_9f4a2c0b5e1a",
  "request_id": "req_1b2c3d4e5f6a",
  "status": "ok",
  "session": {
    "session_id": "sess_2bc1d2f7c9af4dfeb1af1f1e31db7390",
    "expires_at": "2026-03-01T11:30:00Z",
    "user": {
      "user_id": 1,
      "email": "demo@bslbooks.local",
      "name": "BSL 회원",
      "membership_label": "WELCOME",
      "phone": "010-0000-0000"
    }
  }
}
